{
  "schemaVersion": "0.1",
  "kind": "Work",
  "id": "urn:agentos:work:example",
  "revision": 3,
  "createdAt": "2026-09-14T00:00:00Z",
  "authority": "agentos",
  "ownerRef": {
    "kind": "Owner",
    "id": "urn:agentos:owner:example",
    "schemaVersion": "0.1",
    "revision": 1
  },
  "provenance": {
    "producer": "agentos",
    "evidenceClass": "deterministicFixture",
    "sourceRefs": []
  },
  "goal": "Validate an owner-scoped local-reading design fixture.",
  "state": "running",
  "packageRef": {
    "kind": "AgentPackage",
    "id": "urn:agentos:agent-package:example",
    "schemaVersion": "0.1",
    "revision": 1,
    "releaseVersion": "1.0.0",
    "digest": {
      "algorithm": "sha256",
      "value": "aaaaaaaaaaaaaaaaaaaaaaaaaaaaaaaaaaaaaaaaaaaaaaaaaaaaaaaaaaaaaaaa",
      "scope": "packageArchive"
    }
  },
  "runtimeRef": {
    "kind": "Runtime",
    "id": "urn:agentos:runtime:example",
    "schemaVersion": "0.1",
    "revision": 1,
    "releaseVersion": "1.0.0",
    "digest": {
      "algorithm": "sha256",
      "value": "bbbbbbbbbbbbbbbbbbbbbbbbbbbbbbbbbbbbbbbbbbbbbbbbbbbbbbbbbbbbbbbb",
      "scope": "runtimeDistribution"
    }
  },
  "capabilityRef": {
    "kind": "Capability",
    "id": "urn:agentos:capability:example",
    "schemaVersion": "0.1",
    "revision": 1
  },
  "contextSnapshotRef": {
    "kind": "ContextSnapshot",
    "id": "urn:agentos:context-snapshot:example",
    "schemaVersion": "0.1",
    "revision": 1
  },
  "effectiveGrantRefs": [
    {
      "kind": "Grant",
      "id": "urn:agentos:grant:example",
      "schemaVersion": "0.1",
      "revision": 1
    }
  ],
  "requestedActions": [
    "resource.read"
  ],
  "scope": {
    "resources": [
      {
        "resourceRef": {
          "kind": "Resource",
          "id": "urn:agentos:resource:source",
          "schemaVersion": "0.1",
          "revision": 1,
          "digest": {
            "algorithm": "sha256",
            "value": "cccccccccccccccccccccccccccccccccccccccccccccccccccccccccccccccc",
            "scope": "contentBlob"
          }
        },
        "access": [
          "read"
        ],
        "preserveOriginal": true
      }
    ],
    "network": [],
    "secrets": [],
    "memory": {
      "read": "contextSnapshotOnly",
      "write": "candidateOnly",
      "canonicalWrite": false,
      "localState": "none",
      "removal": "removePackageStatePreserveOwnerMemory"
    },
    "events": {
      "subscriptions": [],
      "background": "disabled",
      "triggerAuthority": "none"
    },
    "hostHomeAccess": false,
    "arbitraryShell": false,
    "dockerSocket": false,
    "data": [
      {
        "category": "ownerArtifacts",
        "resourceRefs": [
          {
            "kind": "Resource",
            "id": "urn:agentos:resource:source",
            "schemaVersion": "0.1",
            "revision": 1,
            "digest": {
              "algorithm": "sha256",
              "value": "cccccccccccccccccccccccccccccccccccccccccccccccccccccccccccccccc",
              "scope": "contentBlob"
            }
          }
        ],
        "access": [
          "read"
        ]
      }
    ],
    "filesystem": [
      {
        "root": "owner-root:reference",
        "resourceRef": {
          "kind": "Resource",
          "id": "urn:agentos:resource:source",
          "schemaVersion": "0.1",
          "revision": 1,
          "digest": {
            "algorithm": "sha256",
            "value": "cccccccccccccccccccccccccccccccccccccccccccccccccccccccccccccccc",
            "scope": "contentBlob"
          }
        },
        "rootKind": "referenceFolder",
        "access": [
          "read"
        ]
      }
    ]
  },
  "budget": {
    "maxDurationSeconds": 300,
    "maxCostMinor": 0,
    "currency": "USD",
    "maxTokens": 4096,
    "maxMemoryMiB": 128,
    "maxOutputBytes": 1048576,
    "maxChildren": 0
  },
  "deadline": "2026-09-14T02:00:00Z",
  "idempotencyKey": "fixture_work_0001",
  "attempt": 1,
  "leaseExpiresAt": "2026-09-14T00:10:00Z",
  "checkpointRefs": [],
  "artifactRefs": [],
  "evidenceRefs": [],
  "validationEvidenceRefs": [],
  "transitionAuthority": "agentos",
  "workerCompletion": "proposalOnly",
  "recovery": {
    "maxAttempts": 2,
    "strategy": "retryIdempotently",
    "externalEffects": "deduplicateBeforeRetry"
  }
}
